{"schema_version":"1","analysis_rev":"fx-0001","producer_commit":"w0-fixture","input_artifact_hashes":{},"map_snapshot_date":"2026-10-01","buildings":{"w1001":{"name":"Fixture Block A","addr":null,"height_m":18.0,"floors":5,"pois":[{"name":"Fixture Cafe","kind":"cafe"}],"wikidata":null,"osm_id":"way/1001","geom":{"type":"Polygon","coordinates":[[[-79.3980945,43.6488239],[-79.3977994,43.6488933],[-79.3978454,43.6489958],[-79.3981406,43.6489264],[-79.3980945,43.6488239]]]},"source":"osm","map_snapshot_date":"2026-10-01"},"w1002":{"name":"Fixture Block B","addr":null,"height_m":30.0,"floors":9,"pois":[{"name":"Fixture Cafe","kind":"cafe"}],"wikidata":null,"osm_id":"way/1002","geom":{"type":"Polygon","coordinates":[[[-79.397679,43.6487704],[-79.3973247,43.6488537],[-79.397271,43.6487341],[-79.3976252,43.6486508],[-79.397679,43.6487704]]]},"source":"osm","map_snapshot_date":"2026-10-01"}}}
